{
  "version": 1,
  "templateFamily": "sw",
  "artifactVersion": "draft-777788c3-7552-47cc-8d97-57c74a815db9-v1",
  "identity": {
    "companyName": "리바랩스",
    "serviceOrProductName": "캣독런",
    "productType": "sw"
  },
  "sections": [
    {
      "id": "overview",
      "title": "개요",
      "enabled": true,
      "pageBlocks": [
        {
          "id": "identity",
          "kind": "table",
          "templateRef": {
            "sectionXml": "Contents/section0.xml",
            "anchor": "Contents/section0.xml:P26 | Contents/section1.xml:P47 | Contents/section1.xml:P57"
          },
          "content": {
            "companyName": "리바랩스",
            "serviceOrProductName": "캣독런",
            "productType": "sw",
            "templateVariant": "sw",
            "source": "local POC only; does not update the existing DB record"
          }
        }
      ]
    },
    {
      "id": "feature-analysis",
      "title": "기능별 고객 경험 평가",
      "enabled": true,
      "pageBlocks": [
        {
          "id": "feature-1",
          "kind": "feature-analysis",
          "templateRef": {
            "sectionXml": "Contents/section1.xml",
            "anchor": "Contents/section1.xml:P226-P331",
            "repeatPrototypeAnchor": "Contents/section1.xml:P226-P331"
          },
          "overflowPolicy": "repeat-next-page",
          "content": {
            "featureName": "펫과의 산책",
            "quantitative": {
              "mean": 6.35,
              "standardDeviation": 2.54,
              "distribution": [
                2,
                1,
                3,
                8,
                11,
                16,
                9,
                10,
                17,
                10,
                13
              ]
            },
            "polarityAnalysis": {
              "source": "stored qualitative categories[].clauseCount",
              "donut": [
                {
                  "polarity": "positive",
                  "label": "긍정",
                  "count": 30,
                  "percentage": 32.6
                },
                {
                  "polarity": "negative",
                  "label": "부정",
                  "count": 42,
                  "percentage": 45.7
                },
                {
                  "polarity": "neutral",
                  "label": "중립",
                  "count": 20,
                  "percentage": 21.7
                }
              ],
              "summaries": [
                {
                  "polarity": "positive",
                  "label": "긍정",
                  "text": "펫과 함께하는 산책 경험의 정서적 만족, 산책 동기부여 및 운동 효과, 경로·기록 표시 기능 만족"
                },
                {
                  "polarity": "negative",
                  "label": "부정",
                  "text": "GPS 및 걸음 수 측정 부정확성 문제, 지도 확대·축소 및 조작감 불편, 보물상자·영역 획득 범위 불명확"
                },
                {
                  "polarity": "neutral",
                  "label": "중립",
                  "text": "지도 정보 표시 개선 요청, 레이드·펫 상호작용 개선 제안, 백그라운드 실행 및 배터리 관련 제안"
                }
              ],
              "evidenceGroups": [
                {
                  "polarity": "positive",
                  "label": "긍정",
                  "categories": [
                    {
                      "label": "펫과 함께하는 산책 경험의 정서적 만족",
                      "clauseCount": 10,
                      "quotes": [
                        "펫과 함께 걸음으로서 경험치를 획득할수 있어 좋았어요",
                        "휴대폰 속 펫과 같이 걷는 기분이라 훨씬 힘이 나고 힘들지 않았다",
                        "실제 강아지와 산책하고 싶은 로망이 있는데 이렇게 디지털 펫과 같이 산책하고 경로, 걸음 수가 찍히는 것을 보니 대리만족이 된다"
                      ],
                      "insight": "반려동물 대리만족 요소가 정서적 만족도의 핵심 동력으로 작용"
                    },
                    {
                      "label": "산책 동기부여 및 운동 효과",
                      "clauseCount": 8,
                      "quotes": [
                        "나를 운동하게 만들어준다..",
                        "게임으로 인해 산책을 유도하는것이 매우 신선했습니다",
                        "원래는 산책을 안하는데 이 어플로 인해서 산책도 하고 운동도 하고 건강해지는 느낌입니다"
                      ],
                      "insight": "게임화된 산책 유도 방식이 실제 운동 참여 증가에 기여함이 확인됨"
                    },
                    {
                      "label": "경로·기록 표시 기능 만족",
                      "clauseCount": 6,
                      "quotes": [
                        "지도를 기반으로 내가 움직인 경로를 알 수 있고, 그냥 걷는것보다 느낌이 달랐다.",
                        "걸어간 길을 표시해주고 얼마나 걸었는지 한눈에 알아볼수 있어서 평소 나의 산책코스가 잘 표시가 되서 좋았어요"
                      ],
                      "insight": "경로 시각화와 기록 기능이 산책 몰입도 제고에 긍정적으로 작용"
                    },
                    {
                      "label": "보상 시스템을 통한 흥미 유발",
                      "clauseCount": 6,
                      "quotes": [
                        "뭔가 보상이 있다는 점에서 걷는 것에 동기 부여가 되어 좋았다.",
                        "산책하면서 럭키박스 열고 장소 차지하는 점이 좋아요.",
                        "그냥 걷는 것 뿐만 아니라 보상도 있어서 일석이조마냥 재미있게 걸었습니다."
                      ],
                      "insight": "보상 기반 콘텐츠가 산책 재미 요소로서 긍정적 반응 유도"
                    }
                  ]
                },
                {
                  "polarity": "negative",
                  "label": "부정",
                  "categories": [
                    {
                      "label": "GPS 및 걸음 수 측정 부정확성 문제",
                      "clauseCount": 15,
                      "quotes": [
                        "위치 정확도가 다른 앱에 비해 높지 않습니다 제가 가는 방향의 위치와 캐릭터가 이동하는 위치가 다른 경우가 많습니다",
                        "걸음수와 거리가 전혀 측정되지 않습니다",
                        "실제 걸음 수와 게임에서 측정하는 걸음 수에 많은 차이가 있었다"
                      ],
                      "insight": "위치 및 걸음 수 측정 정확도 개선이 가장 시급한 핵심 불편 요소로 확인됨"
                    },
                    {
                      "label": "지도 확대·축소 및 조작감 불편",
                      "clauseCount": 12,
                      "quotes": [
                        "지도를 확대 및 축소하는 등의 상호작용의 조작감이 매우 불편합니다 전체적으로 너무 확 돌아가고 따라서 정확한 조작이 어렵습니다",
                        "맵이 확대는 되지만 축소가 안돼서 멀리까지 보기가 힘들다.",
                        "지도의 움직임이 자연스럽지 않고 조금만 움직여도 과하게 해당 방향으로 이동하거나 확대나 축소가 된다는 점에서 확인하기 어려웠으며"
                      ],
                      "insight": "지도 줌·회전 민감도 조정 및 시점 고정 기능 도입 필요"
                    },
                    {
                      "label": "보물상자·영역 획득 범위 불명확",
                      "clauseCount": 8,
                      "quotes": [
                        "상자를 먹을 때 어느정도까지 가까이 가야 먹을 수 있는지 확실하지 않다.",
                        "얻으려는 상자또는 무언가가 ??M내에 있는지 설명이 없거나",
                        "보물상자를 상호작용 할 수 있는 위치여도 별도의 표시가 뜨지 않아 아쉽습니다"
                      ],
                      "insight": "획득 가능 범위 시각화 가이드라인 제공으로 사용자 혼란 해소 필요"
                    },
                    {
                      "label": "산책 시작 수동 조작의 번거로움",
                      "clauseCount": 5,
                      "quotes": [
                        "굳이 산책시작을 눌러야만 걸음수가 적용이 된다면 게임을 끄고나서도 상태바에 걸음수가 떠있어야할 이유가 있을까요."
                      ],
                      "insight": "자동 감지 기반 산책 시작 기능 도입으로 사용성 개선 필요"
                    },
                    {
                      "label": "보상 및 콘텐츠 매력 부족",
                      "clauseCount": 2,
                      "quotes": [
                        "산책 모드를 플레이 하면서 직접 이동하여 보상을 얻는 시스템이 플레이어에게 성취감을 주지 못합니다",
                        "얻을 수 있는 아이템 및 재화가 부족합니다"
                      ],
                      "insight": "보상 체계 다양화 및 성취감 강화로 지속 사용 유인 확보 필요"
                    }
                  ]
                },
                {
                  "polarity": "neutral",
                  "label": "중립",
                  "categories": [
                    {
                      "label": "지도 정보 표시 개선 요청",
                      "clauseCount": 6,
                      "quotes": [
                        "지도에 건물이나 도로 이름이 안나와서 세부적인 지역을 파악하기는 힘들었습니다.",
                        "지도가 좀더 넓기 볼수 있으면 좋을거 같다"
                      ],
                      "insight": "지도 상세 정보 및 랜드마크 표기 추가로 탐색 편의성 강화 필요"
                    },
                    {
                      "label": "레이드·펫 상호작용 개선 제안",
                      "clauseCount": 5,
                      "quotes": [
                        "레이드가 너무 빨리 사라진다.",
                        "산책 중에 다른 유저들의 펫과 만나서 할 수있는 아이템도 있으면 좋을 것 같습니다"
                      ],
                      "insight": "레이드 지속시간 및 소셜 상호작용 요소 확대에 대한 요구 존재"
                    },
                    {
                      "label": "백그라운드 실행 및 배터리 관련 제안",
                      "clauseCount": 4,
                      "quotes": [
                        "화면을 계속 켜야 하는건지 꺼도 되는건지 되게 애매한 기능으로 단순히 백그라운드에서 돌아갈 수 있도록 해주면 어떨까 싶습니다.",
                        "켜지 않아도 백그라운드 실행이 되거나, 절전모드가 있으면 좋겠습니다."
                      ],
                      "insight": "백그라운드 실행 옵션 제공으로 배터리 부담 및 사용 불편 완화 필요"
                    },
                    {
                      "label": "정보 제공 방식에 대한 추가 요청",
                      "clauseCount": 3,
                      "quotes": [
                        "칼로리 소모량이나 건강 리포트 같은 추가 피드백이 제공되고",
                        "산책을 얼마나했는지 앱을 들어가지 않고 팝업기능으로 알려주면 좋겠다라는 생각이 들었습니다"
                      ],
                      "insight": "건강 데이터 및 팝업 정보 제공 확대로 부가가치 향상 가능"
                    },
                    {
                      "label": "UI 단순화 및 시각적 개선 요청",
                      "clauseCount": 2,
                      "quotes": [
                        "살짝 포인트를 적게주고 조금 복잡해요",
                        "버튼이 조금만 쉽게 단순화되면 좋을거같아요"
                      ],
                      "insight": "UI 직관성 강화로 초기 사용자 학습 부담 완화 필요"
                    }
                  ]
                }
              ]
            }
          }
        },
        {
          "id": "feature-2",
          "kind": "feature-analysis",
          "templateRef": {
            "sectionXml": "Contents/section1.xml",
            "anchor": "Contents/section1.xml:P332-P427",
            "repeatPrototypeAnchor": "Contents/section1.xml:P226-P331"
          },
          "overflowPolicy": "repeat-next-page",